{
  "id": "scene",
  "camera": "player",
  "resources": {
    "models": [
      {
        "id": "terrain",
        "file": "SceneTerrain.mdl"
      },
      {
        "id": "river",
        "file": "River.mdl"
      }
    ],
    "textures": [
      {
        "id": "outdoors",
        "format": "rgba8",
        "file": "simple_outdoor_texture.jpg"
      },
      {
        "id": "reflection_colour",
        "format": "rgb8",
        "kind": "uninitialised"
      },
      {
        "id": "reflection_depth",
        "format": "d16",
        "kind": "uninitialised"
      }
    ],
    "fonts": []
  },
  "passes": [
    {
      "name": "pre_reflection",
      "kind": "offscreen",
      "target_texture_ids": {
        "colour_texture_id": "reflection_colour",
        "depth_texture_id": "reflection_depth"
      },
      "steps": [
        {
          "name": "skybox",
          "render": "reflection_pre_render",
          "model_id": "skybox",
          "texture_ids": ["skybox"]
        },
        {
          "name": "terrain",
          "render": "reflection_pre_render",
          "model_id": "terrain",
          "texture_ids": ["outdoors"]
        }
      ]
    },
    {
      "name": "compose",
      "kind": "default",
      "steps": [
        {
          "name": "skybox",
          "render": "basic_textured",
          "model_id": "skybox",
          "texture_ids": ["skybox"]
        },
        {
          "name": "river",
          "render": "basic_textured",
          "model_id": "river",
          "texture_ids": ["reflection"]
        },
        {
          "name": "terrain",
          "render": "basic_textured",
          "model_id": "terrain",
          "texture_ids": ["outdoors"]
        }
      ]
    },
    {
      "name": "hud",
      "kind": "default",
      "steps": [
        {
          "name": "text_overlay",
          "render": "text_paint",
          "model_id": "hud",
          "texture_ids": ["musica"]
        }
      ]
    }
  ]
}