{
  "id": "cutscene",
  "camera": "player",
  "resources": {
    "models": [
      {
        "id": "skybox",
        "generator": "skybox"
      }
    ],
    "textures": [
      {
        "id": "skybox",
        "format": "rgba8",
        "file": "bluecloud.jpg",
        "kind": "cubemap"
      }
    ],
    "fonts": []
  },
  "passes": [
    {
      "name": "skybox",
      "kind": "default",
      "steps": [
        {
          "name": "box",
          "render": "basic_textured",
          "model_id": "skybox",
          "texture_ids": ["skybox"]
        }
      ]
    }
  ]
}